{
  "id": "syn_finance_tax_0002",
  "domain": "Finance",
  "sub_domain": "tax",
  "event_type": "finance_obligation",
  "source_type": "synthetic_llm",
  "based_on_template": "Municipal Property Tax Bill (structure only)",
  "generated_by": "claude-sonnet-5",
  "prompt_version": "v1",
  "created_date": "2026-08-03",
  "split": null,
  "input": "From: City of Vaughan Tax Department <taxinfo@vaughan.ca>\nSubject: 2026 Final Property Tax Bill - Account 000123456789\n\nDear Property Owner,\n\nThis is your Final property tax bill for the 2026 tax year. Total amount due: $4,215.00. Payment due date: July 2, 2026.\n\nPlease refer to the attached bill for full payment instructions.\n\nCity of Vaughan",
  "output": {
    "doc_type": "property_tax_bill",
    "issuer": "City of Vaughan",
    "recipient_name": "Jordan Lee",
    "issue_date": "2026-06-01",
    "due_date": "2026-07-02",
    "amounts": [{"type": "payment_due", "value": 4215.00, "currency": "CAD"}],
    "reference_number": "***6789",
    "special_note": null,
    "domain": "Finance"
  }
}
